{
  "$schema": "https://json-schema.org/draft/2020-12/schema",
  "type": "object",
  "properties": {
    "lifecycle_protocol": {
      "type": "integer",
      "exclusiveMinimum": 0,
      "maximum": 9007199254740991
    },
    "version": {
      "type": "string"
    },
    "manager": {
      "type": "string",
      "enum": [
        "launchd",
        "systemd-user",
        "windows-task"
      ]
    },
    "contents": {
      "type": "string"
    }
  },
  "required": [
    "lifecycle_protocol",
    "version",
    "manager",
    "contents"
  ],
  "additionalProperties": {},
  "title": "__lifecycle service-definition"
}
